{
  "format_version": 1,
  "sqlxl_version": "1.3.0",
  "generated_at": "1970-01-01T00:00:00Z",
  "docs_url": "https://github.com/example/sqlxl",
  "summary": "sqlxl is a SQL Server <-> Excel bridge. Three core flows: template-driven DML (insert/update/import), query export (export), and schema inference (infer). Extensibility via BulkOpFeature rows in the target database.",

  "connection_model": {
    "profile_storage_path": "<profile_storage_path>",
    "default_profile_name": "default",
    "override_flags": [
      {
        "name": "--connection",
        "value_type": "connection_string",
        "value_placeholder": "<CONNSTR>",
        "required": false,
        "description": "Ad-hoc connection string. Overrides --profile and the active profile."
      },
      {
        "name": "--profile",
        "value_type": "string",
        "value_placeholder": "<NAME>",
        "required": false,
        "description": "Named saved profile. Overrides the active profile."
      }
    ]
  },

  "commands": [
    {
      "name": "init",
      "summary": "Connect to a SQL Server database, install SqlXL infrastructure, and save the connection profile.",
      "synopses": ["sqlxl init --connection <CONNSTR> [--profile <NAME>]"],
      "flags": [
        {
          "name": "--connection",
          "value_type": "connection_string",
          "value_placeholder": "<CONNSTR>",
          "required": true,
          "description": "SQL Server connection string for the database to initialize."
        },
        {
          "name": "--profile",
          "value_type": "string",
          "value_placeholder": "<NAME>",
          "required": false,
          "default": "default",
          "description": "Name to save this connection under."
        }
      ],
      "behaviors": [
        "Installs the SqlXl.* schema (BulkOpFeatures, ColumnUIConfigurations, DebugLog, Meta_Columns, RequestContext, SavedQueries) into the target database.",
        "Idempotent: re-running updates the profile and re-applies infrastructure."
      ],
      "destructive": false
    },

    {
      "name": "use",
      "summary": "Set the active connection profile.",
      "synopses": ["sqlxl use <PROFILE>"],
      "positional_args": [
        { "name": "PROFILE", "value_type": "string", "required": true, "description": "Name of the profile to activate." }
      ],
      "flags": [],
      "examples": [
        { "command": "sqlxl use prod", "comment": "Switch the active profile to 'prod'." }
      ]
    },

    {
      "name": "connections",
      "summary": "Manage saved connection profiles.",
      "synopses": ["sqlxl connections list", "sqlxl connections remove <PROFILE>"],
      "flags": [],
      "subcommands": [
        {
          "name": "connections list",
          "summary": "List all saved connection profiles.",
          "synopses": ["sqlxl connections list"],
          "flags": []
        },
        {
          "name": "connections remove",
          "summary": "Remove a saved connection profile.",
          "synopses": ["sqlxl connections remove <PROFILE>"],
          "positional_args": [
            { "name": "PROFILE", "value_type": "string", "required": true, "description": "Profile to remove." }
          ],
          "flags": []
        }
      ]
    },

    {
      "name": "insert",
      "summary": "Generate an INSERT template, or import a filled template into a table.",
      "synopses": [
        "sqlxl insert --table <T> [--output <PATH>] [--no-launch]",
        "sqlxl insert --table <T> --file <XLSX> [--no-launch]"
      ],
      "flags": [
        { "name": "--table", "value_type": "string", "value_placeholder": "<TABLE>", "required": true, "description": "Domain table, e.g. dbo.Products or just Products (assumes dbo)." },
        { "name": "--file", "value_type": "path", "value_placeholder": "<FILE>", "required": false, "description": "Excel file to import. Omit to generate a template." },
        { "name": "--output", "value_type": "path", "value_placeholder": "<FILE>", "required": false, "description": "Output path for generated template. Default: <Table>_insert_YYYYMMDD.xlsx." },
        { "name": "--no-launch", "value_type": "bool", "required": false, "default": false, "description": "Do not auto-open the generated Excel file. USE THIS in agents/scripts." },
        { "name": "--connection", "value_type": "connection_string", "value_placeholder": "<CONNSTR>", "required": false, "description": "Override profile." },
        { "name": "--profile", "value_type": "string", "value_placeholder": "<NAME>", "required": false, "description": "Override active profile." }
      ],
      "behaviors": [
        "If no BulkOpFeature exists for the table, AUTO-SCAFFOLDS one: creates staging table SqlXl.Staging_<Table>_ForInserts, sproc <Table>_InsertFromStaging, and a BulkOpFeatures row of type 'Insert'.",
        "Generated templates exclude IDENTITY/PK columns from the Data sheet (they remain in the Metadata sheet with IsPrimaryKey=YES).",
        "Templates are 3-sheet workbooks: Data, DropdownOptions, Metadata."
      ],
      "examples": [
        { "command": "sqlxl insert --table dbo.Products --output t.xlsx --no-launch", "comment": "Generate template; auto-scaffolds feature on first run." },
        { "command": "sqlxl insert --table dbo.Products --file t.xlsx --no-launch", "comment": "Import a filled template." }
      ]
    },

    {
      "name": "update",
      "summary": "Generate an UPDATE template pre-populated with existing rows, or import a filled template.",
      "synopses": [
        "sqlxl update --table <T> [--where <CLAUSE>] [--output <PATH>] [--no-launch]",
        "sqlxl update --table <T> --file <XLSX> [--no-launch]"
      ],
      "flags": [
        { "name": "--table", "value_type": "string", "value_placeholder": "<TABLE>", "required": true, "description": "Domain table." },
        { "name": "--where", "value_type": "sql", "value_placeholder": "<CLAUSE>", "required": false, "scope": "template_generation", "description": "SQL WHERE clause to filter rows for the template (template generation only — IGNORED on import)." },
        { "name": "--file", "value_type": "path", "value_placeholder": "<FILE>", "required": false, "description": "Excel file to import. Omit to generate." },
        { "name": "--output", "value_type": "path", "value_placeholder": "<FILE>", "required": false, "description": "Default: <Table>_update_YYYYMMDD.xlsx." },
        { "name": "--no-launch", "value_type": "bool", "required": false, "description": "Do not auto-open Excel." }
      ],
      "behaviors": [
        "Template is pre-populated with existing rows matching --where (or all rows if omitted).",
        "Import is keyed by primary key — PK columns must be present and unchanged in the imported file."
      ]
    },

    {
      "name": "import",
      "summary": "Generate a template or import data via a custom BulkOpFeature.",
      "synopses": [
        "sqlxl import --feature <ID> [--output <PATH>] [--no-launch]",
        "sqlxl import --feature <ID> --file <XLSX> [--no-launch]"
      ],
      "flags": [
        { "name": "--feature", "value_type": "int", "value_placeholder": "<ID>", "required": true, "description": "BulkOpFeature ID from SqlXl.BulkOpFeatures." },
        { "name": "--file", "value_type": "path", "value_placeholder": "<FILE>", "required": false, "description": "Excel file to import." },
        { "name": "--output", "value_type": "path", "value_placeholder": "<FILE>", "required": false, "description": "Default: Feature_YYYYMMDD.xlsx." },
        { "name": "--no-launch", "value_type": "bool", "required": false, "description": "Do not auto-open Excel." }
      ],
      "behaviors": [
        "Generic entry point for any BulkOpFeature (Insert, Update, Delete, or Custom).",
        "Use this when invoking a manually-authored Custom feature, or when targeting a specific feature ID."
      ]
    },

    {
      "name": "export",
      "summary": "Export SQL query results to Excel.",
      "synopses": ["sqlxl export --query <SQL> [--output <PATH>] [--no-launch]"],
      "flags": [
        { "name": "--query", "value_type": "sql", "value_placeholder": "<SQL>", "required": true, "description": "SELECT statement (validated via SqlXl infrastructure before execution)." },
        { "name": "--output", "value_type": "path", "value_placeholder": "<FILE>", "required": false, "description": "Default: export_YYYYMMDD_HHmmss.xlsx." },
        { "name": "--no-launch", "value_type": "bool", "required": false, "description": "Do not auto-open Excel." }
      ],
      "prerequisites": ["init"],
      "behaviors": [
        "Single-sheet workbook output: column headers in row 1, data below.",
        "Query is validated against SqlXl infrastructure before execution — `init` must have been run on the target DB."
      ]
    },

    {
      "name": "test",
      "summary": "Auto-generate and run test data against all configured features for a table.",
      "synopses": ["sqlxl test --table <T> [--rows <N>]"],
      "flags": [
        { "name": "--table", "value_type": "string", "value_placeholder": "<TABLE>", "required": true, "description": "Domain table to test." },
        { "name": "--rows", "value_type": "int", "value_placeholder": "<N>", "required": false, "default": 1, "description": "Test rows per feature. Max: 100." }
      ],
      "behaviors": [
        "Synthesizes rows respecting unique constraints both against existing data AND across the generated batch.",
        "Test data is COMMITTED to the database — run only against disposable DBs.",
        "Each configured feature runs independently; one feature failing does not stop others.",
        "With small tables and narrow unique-column value spaces, --rows N (N>1) frequently collides. Use --rows 1 to verify pipeline."
      ],
      "destructive": true
    },

    {
      "name": "infer",